{
 "schema_version": 1,
 "record_type": "category_map",
 "map_id": "fixture.iref_eval.map",
 "description": "A2.2b evaluation fixture map; test values only",
 "release": "fixture-v1",
 "model_vocabulary": [
  "box",
  "chair",
  "crib",
  "desk",
  "monitor",
  "table"
 ],
 "entries": [
  {
   "source_label": "box",
   "standard": "box",
   "model": "box"
  },
  {
   "source_label": "chair",
   "standard": "chair",
   "model": "chair"
  },
  {
   "source_label": "desk",
   "standard": "desk",
   "model": "desk"
  },
  {
   "source_label": "monitor",
   "standard": "monitor",
   "model": "monitor"
  },
  {
   "source_label": "table",
   "standard": "table",
   "model": "table"
  }
 ]
}
