{
  "schema_version": 1,
  "record_type": "category_map",
  "map_id": "map.bedroom",
  "description": "Category map of the bedroom fixture: the detector's COCO labels for the development objects, onto parser v1's words",
  "release": "fixture-v3",
  "model_vocabulary": [
    "bed",
    "bottle",
    "chair",
    "keyboard",
    "laptop",
    "mouse",
    "table",
    "television"
  ],
  "entries": [
    {
      "source_label": "chair",
      "standard": "chair",
      "model": "chair"
    },
    {
      "source_label": "dining table",
      "standard": "table",
      "model": "table"
    },
    {
      "source_label": "bed",
      "standard": "bed",
      "model": "bed"
    },
    {
      "source_label": "bottle",
      "standard": "bottle",
      "model": "bottle"
    },
    {
      "source_label": "laptop",
      "standard": "laptop",
      "model": "laptop"
    },
    {
      "source_label": "tv",
      "standard": "television",
      "model": "television"
    },
    {
      "source_label": "keyboard",
      "standard": "keyboard",
      "model": "keyboard"
    },
    {
      "source_label": "mouse",
      "standard": "mouse",
      "model": "mouse"
    }
  ]
}
